{
  "schema_version": 1,
  "kind": "immutable-w1-effectiveness-projection",
  "source_evidence_sha256": "663b6a4729ff3b59636578ac5262ae7ae28aa673fbc214930b87803b34a8fce8",
  "effectiveness_status": "blocked",
  "jobs": {
    "complete": 12,
    "required": 12
  },
  "judgments": {
    "complete": 27,
    "required": 27
  },
  "paired": {
    "pass_count": 0,
    "required_count": 3
  },
  "diversity": {
    "pass_count": 0,
    "required_count": 3
  },
  "immutable_stop_rule": true
}
